{
  "advice": null,
  "applied_scope": [
    "phase_sequencing"
  ],
  "authority_retained_by": null,
  "binding": true,
  "charter_revision": "charter-2",
  "checkpoint_digest": "5288eab83134dbcd3b0657ba9daeffea87955d2c283d3f1ec423cb0ead9f06fc",
  "context_manifest_digest": "d79ce80badfc22014b4c3cc42c20d13fc7d2ac2a97f5da6d6b8b3b78c7cc5681",
  "created_at": "2026-08-08T00:00:00Z",
  "decided_by": "authoritative_supervisor",
  "decision_digest": "8f730b934595ea15ef92e579854a1a1d555ec7af2f3ef22b7d29240c2720d833",
  "decision_id": "adec-example-1",
  "delegation_revision": "deleg-3",
  "mode": "ADJUDICATE",
  "outcome": "APPROVED_BOUNDED_SCOPE",
  "rationale_digest": "aaaaaaaaaaaaaaaaaaaaaaaaaaaaaaaaaaaaaaaaaaaaaaaaaaaaaaaaaaaaaaaa",
  "request_binding_digest": "8e80e0d4ccdfd60aebd1247a9c764b1d8e4593c7ef53700ffd13a6bcdd6a4d2f",
  "request_id": "areq-example-1",
  "requested_scope": [
    "phase_sequencing"
  ],
  "run_id": "run-example",
  "schema_version": "1.0",
  "state_revision": 12,
  "task_id": "task-example"
}
